zip,sector,fullTimeEmployees,longBusinessSummary,city,phone,state,country,companyOfficers,website,maxAge,address1,industry,ebitdaMargins,profitMargins,grossMargins,operatingCashflow,revenueGrowth,operatingMargins,ebitda,targetLowPrice,recommendationKey,grossProfits,freeCashflow,targetMedianPrice,currentPrice,earningsGrowth,currentRatio,returnOnAssets,numberOfAnalystOpinions,targetMeanPrice,debtToEquity,returnOnEquity,targetHighPrice,totalCash,totalDebt,totalRevenue,totalCashPerShare,financialCurrency,revenuePerShare,quickRatio,recommendationMean,exchange,shortName,longName,exchangeTimezoneName,exchangeTimezoneShortName,isEsgPopulated,gmtOffSetMilliseconds,quoteType,symbol,messageBoardId,market,annualHoldingsTurnover,enterpriseToRevenue,beta3Year,enterpriseToEbitda,52WeekChange,morningStarRiskRating,forwardEps,revenueQuarterlyGrowth,sharesOutstanding,fundInceptionDate,annualReportExpenseRatio,totalAssets,bookValue,sharesShort,sharesPercentSharesOut,fundFamily,lastFiscalYearEnd,heldPercentInstitutions,netIncomeToCommon,trailingEps,lastDividendValue,SandP52WeekChange,priceToBook,heldPercentInsiders,nextFiscalYearEnd,yield,mostRecentQuarter,shortRatio,sharesShortPreviousMonthDate,floatShares,beta,enterpriseValue,priceHint,threeYearAverageReturn,lastSplitDate,lastSplitFactor,legalType,lastDividendDate,morningStarOverallRating,earningsQuarterlyGrowth,priceToSalesTrailing12Months,dateShortInterest,pegRatio,ytdReturn,forwardPE,lastCapGain,shortPercentOfFloat,sharesShortPriorMonth,impliedSharesOutstanding,category,fiveYearAverageReturn,previousClose,regularMarketOpen,twoHundredDayAverage,trailingAnnualDividendYield,payoutRatio,volume24Hr,regularMarketDayHigh,navPrice,averageDailyVolume10Day,regularMarketPreviousClose,fiftyDayAverage,trailingAnnualDividendRate,open,toCurrency,averageVolume10days,expireDate,algorithm,dividendRate,exDividendDate,circulatingSupply,startDate,regularMarketDayLow,currency,trailingPE,regularMarketVolume,lastMarket,maxSupply,openInterest,marketCap,volumeAllCurrencies,strikePrice,averageVolume,dayLow,ask,askSize,volume,fiftyTwoWeekHigh,fromCurrency,fiveYearAvgDividendYield,fiftyTwoWeekLow,bid,tradeable,dividendYield,bidSize,dayHigh,coinMarketCapLink,regularMarketPrice,preMarketPrice,logo_url,fax,Current_Date,Previous_Date,Last_Dividend_Date,Symbol,Company,Industry,Payout_Ratio,Dividend_Yield,Daily_Change_Percent,Fifty_Day_Avg_Percent,TwoHundred_Day_Avg_Percent,Week_52_Low_Percent,Week_52_High_Percent,Current_Pricing,Previous_Close_Pricing,Fifty_Day_Average_Pricing,TwoHundred_Day_Avg_Pricing,Week_52_Low_Pricing,Week_52_High_Pricing
60607,Consumer Cyclical,100000,"McDonald's Corporation operates and franchises McDonald's restaurants in the United States and internationally. Its restaurants offer hamburgers and cheeseburgers, chicken sandwiches and nuggets, wraps, fries, salads, oatmeal, shakes, desserts, sundaes, soft serve cones, bakery items, soft drinks, coffee, and beverages and other beverages, as well as breakfast menu, including biscuit and bagel sandwiches, breakfast burritos, hotcakes, and other sandwiches. As of December 31, 2021, the company operated 40,031 restaurants. McDonald's Corporation was founded in 1940 and is headquartered in Chicago, Illinois.",Chicago,630 623 3000,IL,United States,[],https://corporate.mcdonalds.com,1,110 North Carpenter Street,Restaurants,0.5182,0.25415,0.56132,7851800064,-0.053,0.437,12056000512,250,buy,12580200000,4133400064,290,267.84,-0.063,1.647,0.12554,35,288.03,,,328,2828300032,47379898368,23265200128,3.862,USD,31.433,1.353,2.0,NYQ,McDonald's Corporation,McDonald's Corporation,America/New_York,EST,False,-18000000,EQUITY,MCD,finmb_139488,us_market,,10.459,,20.183,0.07748628,,10.47,,732424000,,,,-8.965,6079527,0.0083,,1640908800,0.70125,5912800256,7.93,1.38,-0.15599734,,0.00169,1703980800,,1664496000,1.84,1664496000,731391174,0.647805,243324125184,2,,920851200,2:1,,1661904000,,-0.078,8.432012,1667174400,4.1,,25.581661,,0.0083,6751909,0,,,272.27,270.25,250.49605,0.020273993,0.6961,,271.03,,3317250,272.27,254.0938,5.52,270.25,,3317250,,,6.08,1669766400,,,266.34,USD,33.775536,5131933,,,,196172447744,,,2918153,266.34,267.84,900,5131933,281.67,,2.3,217.68,267.09,False,0.0224,800,271.03,,267.84,269.8,https://logo.clearbit.com/corporate.mcdonalds.com,,2022-11-15 22:44:46.057187,2022-11-14 22:44:46.057187,1661904000,MCD,McDonald's Corporation,Restaurants,0.6961,2.2399999999999998,-1.6539725209080074,5.132243130226997,6.4754890979689295,18.727598566308234,-5.163530465949837,$267.84,$272.27,$254.09,$250.50,$217.68,$281.67
10577,Consumer Defensive,309000,"PepsiCo, Inc. manufactures, markets, distributes, and sells various beverages and convenient foods worldwide. The company operates through seven segments: Frito-Lay North America; Quaker Foods North America; PepsiCo Beverages North America; Latin America; Europe; Africa, Middle East and South Asia; and Asia Pacific, Australia and New Zealand and China Region. It provides dips, cheese-flavored snacks, and spreads, as well as corn, potato, and tortilla chips; cereals, rice, pasta, mixes and syrups, granola bars, grits, oatmeal, rice cakes, simply granola, and side dishes; beverage concentrates, fountain syrups, and finished goods; ready-to-drink tea, coffee, and juices; dairy products; and sparkling water makers and related products. It serves wholesale and other distributors, foodservice customers, grocery stores, drug stores, convenience stores, discount/dollar stores, mass merchandisers, membership stores, hard discounters, e-commerce retailers and authorized independent bottlers, and others through a network of direct-store-delivery, customer warehouse, and distributor networks, as well as directly to consumers through e-commerce platforms and retailers. The company was founded in 1898 and is headquartered in Purchase, New York.",Purchase,914 253 2000,NY,United States,[],https://www.pepsico.com,1,700 Anderson Hill Road,Beverages—Non-Alcoholic,0.18120001,0.11614,0.5324,11288000512,0.088,0.15052,15155999744,170,buy,42429000000,7095875072,183,177.19,0.219,0.918,0.08384,20,183.68,205.095,0.5571,200,6742000128,39245000704,83643998208,4.894,USD,60.491,0.681,2.5,NMS,"Pepsico, Inc.","PepsiCo, Inc.",America/New_York,EST,False,-18000000,EQUITY,PEP,finmb_32854,us_market,,3.301,,18.22,0.08177757,,7.28,,1377709952,,,,13.761,9424716,0.0068,,1640390400,0.74050003,9713999872,6.99,1.15,-0.15599734,12.876245,0.00149,1703462400,,1662163200,1.71,1664496000,1374967568,0.595574,276143538176,2,,833328000,2:1,,1661990400,,0.215,2.9185169,1667174400,3.19,,24.339285,,0.0068,10742666,0,,,176.73,178.04,169.8934,0.025179652,0.6366,,178.7,,4815330,176.73,172.0792,4.45,178.04,,4815330,,,4.6,1661990400,,,175.42,USD,25.349072,5153752,,,,244116422656,,,5047111,175.42,177.23,800,5153752,183.58,,2.82,153.37,175.69,False,0.025999999,900,178.7,,177.19,178.38,https://logo.clearbit.com/pepsico.com,,2022-11-15 22:44:46.057187,2022-11-14 22:44:46.057187,1661990400,PEP,"Pepsico, Inc.",Beverages—Non-Alcoholic,0.6366,2.5999999,0.2596083300412032,2.8843614199446987,4.117952480388275,13.443196568655114,-3.606298323833182,$177.19,$176.73,$172.08,$169.89,$153.37,$183.58
98052-6399,Technology,221000,"Microsoft Corporation develops, licenses, and supports software, services, devices, and solutions worldwide. The company operates in three segments: Productivity and Business Processes, Intelligent Cloud, and More Personal Computing. The Productivity and Business Processes segment offers Office, Exchange, SharePoint, Microsoft Teams, Office 365 Security and Compliance, Microsoft Viva, and Skype for Business; Skype, Outlook.com, OneDrive, and LinkedIn; and Dynamics 365, a set of cloud-based and on-premises business solutions for organizations and enterprise divisions. The Intelligent Cloud segment licenses SQL, Windows Servers, Visual Studio, System Center, and related Client Access Licenses; GitHub that provides a collaboration platform and code hosting service for developers; Nuance provides healthcare and enterprise AI solutions; and Azure, a cloud platform. It also offers enterprise support, Microsoft consulting, and nuance professional services to assist customers in developing, deploying, and managing Microsoft server and desktop solutions; and training and certification on Microsoft products. The More Personal Computing segment provides Windows original equipment manufacturer (OEM) licensing and other non-volume licensing of the Windows operating system; Windows Commercial, such as volume licensing of the Windows operating system, Windows cloud services, and other Windows commercial offerings; patent licensing; and Windows Internet of Things. It also offers Surface, PC accessories, PCs, tablets, gaming and entertainment consoles, and other devices; Gaming, including Xbox hardware, and Xbox content and services; video games and third-party video game royalties; and Search, including Bing and Microsoft advertising. The company sells its products through OEMs, distributors, and resellers; and directly through digital marketplaces, online stores, and retail stores. Microsoft Corporation was founded in 1975 and is headquartered in Redmond, Washington.",Redmond,425 882 8080,WA,United States,[],https://www.microsoft.com,1,One Microsoft Way,Software—Infrastructure,0.48672,0.34366,0.6826,87693000704,0.106,0.41691002,98841001984,234,buy,135620000000,46155874304,290,241.97,-0.133,1.84,0.15223,46,299.37,44.442,0.42875,411,107244003328,77136003072,203074994176,14.387,USD,27.142,1.585,1.8,NMS,Microsoft Corporation,Microsoft Corporation,America/New_York,EST,False,-18000000,EQUITY,MSFT,finmb_21835,us_market,,8.719,,17.913,-0.28771526,,11.18,,7454470144,,,,23.276,36909448,0.005,,1656547200,0.72283,69788999680,9.29,0.62,-0.15599734,10.395687,0.00059999997,1719705600,,1664496000,1.15,1664496000,7447838663,0.91984,1770520051712,2,,1045526400,2:1,,1660694400,,-0.144,8.882227,1667174400,1.94,,21.643112,,0.005,34921823,0,,,241.55,245.66,268.9493,0.010515421,0.26700002,,247.0,,34393660,241.55,239.2014,2.54,245.66,,34393660,,,2.72,1668556800,,,240.05,USD,26.046286,31390117,,,,1803758206976,,,28881166,240.05,240.78,1200,31390117,349.67,,1.18,213.43,240.6,False,0.0113,800,247.0,,241.97,245.6,https://logo.clearbit.com/microsoft.com,425 706 7329,2022-11-15 22:44:46.057187,2022-11-14 22:44:46.057187,1660694400,MSFT,Microsoft Corporation,Software—Infrastructure,0.26700002,1.13,0.1735752365995733,1.1441914286895039,-11.149853287597635,11.79485060131421,-44.5096499566062,$241.97,$241.55,$239.20,$268.95,$213.43,$349.67
95014,Technology,164000,"Apple Inc. designs, manufactures, and markets smartphones, personal computers, tablets, wearables, and accessories worldwide. It also sells various related services. In addition, the company offers iPhone, a line of smartphones; Mac, a line of personal computers; iPad, a line of multi-purpose tablets; and wearables, home, and accessories comprising AirPods, Apple TV, Apple Watch, Beats products, and HomePod. Further, it provides AppleCare support and cloud services store services; and operates various platforms, including the App Store that allow customers to discover and download applications and digital content, such as books, music, video, games, and podcasts. Additionally, the company offers various services, such as Apple Arcade, a game subscription service; Apple Fitness+, a personalized fitness service; Apple Music, which offers users a curated listening experience with on-demand radio stations; Apple News+, a subscription news and magazine service; Apple TV+, which offers exclusive original content; Apple Card, a co-branded credit card; and Apple Pay, a cashless payment service, as well as licenses its intellectual property. The company serves consumers, and small and mid-sized businesses; and the education, enterprise, and government markets. It distributes third-party applications for its products through the App Store. The company also sells its products through its retail and online stores, and direct sales force; and third-party cellular network carriers, wholesalers, retailers, and resellers. Apple Inc. was incorporated in 1977 and is headquartered in Cupertino, California.",Cupertino,408 996 1010,CA,United States,[],https://www.apple.com,1,One Apple Park Way,Consumer Electronics,0.33105,0.2531,0.43310001,122151002112,0.081,0.30289,130541002752,122,buy,170782000000,90215251968,180,150.04,0.048,0.879,0.21214001,41,178.15,261.446,1.75459,214,48304001024,132480000000,394328014848,3.036,USD,24.317,0.709,1.9,NMS,Apple Inc.,Apple Inc.,America/New_York,EST,False,-18000000,EQUITY,AAPL,finmb_24937,us_market,,6.253,,18.888,-0.033943594,,6.81,,15908100096,,,,3.178,103178670,0.0064999997,,1663977600,0.60247004,99802996736,6.11,0.23,-0.15599734,47.212082,0.00072999997,1727136000,,1663977600,1.14,1664496000,15891414476,1.246644,2465621344256,2,,1598832000,4:1,,1667520000,,0.008,6.052959,1667174400,2.67,,22.032305,,0.0064999997,103251184,0,,,148.28,152.215,155.57056,0.006069598,0.14729999,,153.59,,94695190,148.28,147.513,0.9,152.215,,94695190,,,0.92,1667520000,,,148.5623,USD,24.556463,89492974,,,,2386851266560,,,89815852,148.5623,149.7,1000,89492974,182.94,,1.0,129.04,150.06,False,0.0061000003,1800,153.59,,150.04,152.01,https://logo.clearbit.com/apple.com,,2022-11-15 22:44:46.057187,2022-11-14 22:44:46.057187,1667520000,AAPL,Apple Inc.,Consumer Electronics,0.14729999,0.61000003,1.1730205278592314,1.6842175419887941,-3.686057051452952,13.996267661956812,-21.927486003732344,$150.04,$148.28,$147.51,$155.57,$129.04,$182.94
92130,Real Estate,388,"Realty Income, The Monthly Dividend Company, is an S&P 500 company dedicated to providing stockholders with dependable monthly income. The company is structured as a REIT, and its monthly dividends are supported by the cash flow from over 6,500 real estate properties owned under long-term lease agreements with our commercial clients. To date, the company has declared 608 consecutive common stock monthly dividends throughout its 52-year operating history and increased the dividend 109 times since Realty Income's public listing in 1994 (NYSE: O). The company is a member of the S&P 500 Dividend Aristocrats index. Additional information about the company can be obtained from the corporate website at www.realtyincome.com.",San Diego,858-284-5000,CA,United States,[],https://www.realtyincome.com,1,11995 El Camino Real,REIT—Retail,0.91138,0.20613001,0.9359,2285488896,0.708,0.39459,2857015040,61,buy,1947964000,1463676928,70,64.74,0.046,1.464,0.02221,15,69.43,62.882,0.03224,75,192444992,16892883968,3134821888,0.307,USD,5.373,1.23,2.4,NYQ,Realty Income Corporation,Realty Income Corporation,America/New_York,EST,False,-18000000,EQUITY,O,finmb_339305,us_market,,18.368,,20.154,-0.109629035,,1.35,,627153984,,,,42.633,28496521,0.0454,,1640908800,0.81088996,646184000,0.99,0.248,-0.15599734,1.5185419,0.00124,1703980800,,1664496000,6.97,1664496000,626125329,0.791802,57580036096,2,,1636934400,1032:1000,,1667174400,,0.626,12.951916,1667174400,3.44,,47.955555,,0.0531,26713689,0,,,64.08,64.9,67.1197,0.046083022,2.9828,,65.39,,3572190,64.08,61.5036,2.953,64.9,,3572190,,,2.98,1669766400,,,63.96,USD,65.393936,4089499,,,,40601948160,,,4317990,63.96,64.72,1400,4089499,75.4,,4.31,55.5,64.71,False,0.0458,900,65.39,,64.74,64.9,https://logo.clearbit.com/realtyincome.com,,2022-11-15 22:44:46.057187,2022-11-14 22:44:46.057187,1667174400,O,Realty Income Corporation,REIT—Retail,2.9828,4.58,1.0194624652455926,4.9990732159406805,-3.6757800432499224,14.272474513438363,-16.46586345381528,$64.74,$64.08,$61.50,$67.12,$55.50,$75.40
45202,Consumer Defensive,106000,"The Procter & Gamble Company provides branded consumer packaged goods worldwide. It operates through five segments: Beauty; Grooming; Health Care; Fabric & Home Care; and Baby, Feminine & Family Care. The Beauty segment offers conditioners, shampoos, styling aids, and treatments under the Head & Shoulders, Herbal Essences, Pantene, and Rejoice brands; and antiperspirants and deodorants, personal cleansing, and skin care products under the Olay, Old Spice, Safeguard, Secret, and SK-II brands. The Grooming segment provides shave care products and appliances under the Braun, Gillette, and Venus brand names. The Health Care segment offers toothbrushes, toothpastes, and other oral care products under the Crest and Oral-B brand names; and gastrointestinal, rapid diagnostics, respiratory, vitamins/minerals/supplements, pain relief, and other personal health care products under the Metamucil, Neurobion, Pepto-Bismol, and Vicks brands. The Fabric & Home Care segment provides fabric enhancers, laundry additives, and laundry detergents under the Ariel, Downy, Gain, and Tide brands; and air care, dish care, P&G professional, and surface care products under the Cascade, Dawn, Fairy, Febreze, Mr. Clean, and Swiffer brands. The Baby, Feminine & Family Care segment offers baby wipes, taped diapers, and pants under the Luvs and Pampers brands; adult incontinence and feminine care products under the Always, Always Discreet, and Tampax brands; and paper towels, tissues, and toilet papers under the Bounty, Charmin, and Puffs brands. The company sells its products primarily through mass merchandisers, e-commerce, grocery stores, membership club stores, drug stores, department stores, distributors, wholesalers, specialty beauty stores, high-frequency stores, pharmacies, electronics stores, and professional channels, as well as directly to consumers. The Procter & Gamble Company was founded in 1837 and is headquartered in Cincinnati, Ohio.",Cincinnati,513 983 1100,OH,United States,[],https://www.pginvestor.com,1,One Procter & Gamble Plaza,Household & Personal Products,0.26552,0.18107,0.47234002,16149999616,0.013,0.23122999,21364000768,105,buy,38212000000,10122000384,145,140.49,-0.021,0.615,0.09856,22,146.29,74.442,0.32244998,170,6710000128,33002999808,80460996608,2.832,USD,33.53,0.339,2.4,NYQ,Procter & Gamble Company (The),The Procter & Gamble Company,America/New_York,EST,False,-18000000,EQUITY,PG,finmb_33328,us_market,,4.492,,16.918,-0.04160434,,6.25,,2369700096,,,,18.247,13907989,0.0058999998,,1656547200,0.65985,14286999552,5.77,0.913,-0.15599734,7.6993484,0.00124,1719705600,,1664496000,1.98,1664496000,2367019105,0.399709,361442181120,2,,1087776000,2:1,,1666224000,,-0.042,4.1376467,1667174400,5.06,,22.478401,,0.0058999998,12766425,0,,,140.98,142.09,145.5977,0.02529437,0.6181,,143.2,,6596880,140.98,132.9294,3.566,142.09,,6596880,,,3.65,1666224000,,,139.7,USD,24.348354,7248711,,,,332919177216,,,6689106,139.7,141.5,800,7248711,165.35,,2.67,122.18,140.05,False,0.025899999,800,143.2,,140.49,142.91,https://logo.clearbit.com/pginvestor.com,,2022-11-15 22:44:46.057187,2022-11-14 22:44:46.057187,1666224000,PG,Procter & Gamble Company (The),Household & Personal Products,0.6181,2.5899999,-0.34877927254607494,5.381592995942787,-3.6356324293543985,13.032956082283437,-17.695209623460734,$140.49,$140.98,$132.93,$145.60,$122.18,$165.35
08933,Healthcare,141700,"Johnson & Johnson, together with its subsidiaries, researches and develops, manufactures, and sells various products in the healthcare field worldwide. The company's Consumer Health segment offers baby care products under the JOHNSON'S and AVEENO Baby brands; oral care products under the LISTERINE brand; skin health/beauty products under the AVEENO, CLEAN & CLEAR, DR. CI:LABO, NEUTROGENA, and OGX brands; TYLENOL acetaminophen products; SUDAFED cold, flu, and allergy products; BENADRYL and ZYRTEC allergy products; MOTRIN IB ibuprofen products; NICORETTE smoking cessation products; and PEPCID acid reflux products. It also offers STAYFREE and CAREFREE sanitary pads; o.b. tampons; adhesive bandages under the BAND-AID brand; and first aid products under the NEOSPORIN brand. It serves general public, retail outlets, and distributors. The company's Pharmaceutical segment offers products for rheumatoid arthritis, psoriatic arthritis, inflammatory bowel disease, and psoriasis; HIV/AIDS and COVID-19 infectious diseases; mood disorders, neurodegenerative disorders, and schizophrenia; prostate cancer, hematologic malignancies, lung cancer, and bladder cancer; thrombosis, diabetes and macular degeneration; and pulmonary arterial hypertension. This segment serves retailers, wholesalers, distributors, hospitals, and healthcare professionals directly for prescription use. Its MedTech segment provides electrophysiology products to treat cardiovascular diseases; neurovascular care products to treat hemorrhagic and ischemic stroke; orthopaedics products in support of hips, knees, trauma, spine, sports, and other; advanced and general surgery solutions that focus on breast aesthetics, ear, nose, and throat procedures; and disposable contact lenses and ophthalmic products related to cataract and laser refractive surgery under the ACUVUE brand. This segment serves wholesalers, hospitals, and retailers. The company was founded in 1886 and is based in New Brunswick, New Jersey.",New Brunswick,732 524 0400,NJ,United States,[],https://www.jnj.com,1,One Johnson & Johnson Plaza,Drug Manufacturers—General,0.3337,0.19947,0.67516,21575999488,0.019,0.26003,32049000448,160,buy,64020000000,17918375936,181,172.39,0.226,1.432,0.0881,19,184.21,42.932,0.26447,215,34079000576,32027000832,96041000960,13.035,USD,36.125,1.097,2.4,NYQ,Johnson & Johnson,Johnson & Johnson,America/New_York,EST,False,-18000000,EQUITY,JNJ,finmb_139677,us_market,,4.586,,13.743,0.052853942,,10.37,,2614479872,,,,28.507,12348035,0.0047,,1641081600,0.71122,19157000192,7.18,1.13,-0.15599734,6.0472865,0.00099,1704153600,,1664668800,1.83,1664496000,2611293937,0.567645,440449335296,2,,992390400,2:1,,1661126400,,0.216,4.6928935,1667174400,4.39,,16.623915,,0.0047,12936583,0,,,171.91,172.19,172.1413,0.025478449,0.61,,173.0,,6742790,171.91,167.0648,4.38,172.19,,6742790,,,4.52,1668988800,,,170.521,USD,24.00975,8556570,,,,450710175744,,,7111892,170.521,172.13,900,8556570,186.69,,2.59,155.72,172.39,False,0.026700001,800,173.0,,172.39,171.92,https://logo.clearbit.com/jnj.com,,2022-11-15 22:44:46.057187,2022-11-14 22:44:46.057187,1661126400,JNJ,Johnson & Johnson,Drug Manufacturers—General,0.61,2.6700001,0.27843842450257544,3.089042287835719,0.14426590869539144,9.669934450954225,-8.295144729972744,$172.39,$171.91,$167.06,$172.14,$155.72,$186.69
